Date,Time,Location,Latitude,Longitude,Direction,Type,Lanes Blocked,Involved,Tweet,Source
8/20/2018,7:55 AM,ORTIGAS EMERALD,14.586343,121.061481,EB,VEHICULAR ACCIDENT,1.0,TAXI AND MC,MMDA ALERT: Vehicular accident at Ortigas Emerald EB  involving taxi and MC as of 7:55 AM. 1 lane occupied. MMDA on site. #mmda,https://twitter.com/mmda/status/1031330201970532352
8/20/2018,8:42 AM,EDSA GUADIX,14.589432,121.057243,NB,STALLED L300 DUE TO MECHANICAL PROBLEM,1.0,L300,MMDA ALERT: Stalled L300 due to mechanical problem at EDSA Guadix NB as of 8:42 AM. 1 lane occupied. MMDA enforcer on site. #mmda,https://twitter.com/mmda/status/1031346247745990656
8/20/2018,9:13 AM,EDSA ROCKWELL,14.559818,121.040737,SB,VEHICULAR ACCIDENT,1.0,SUV AND L300,MMDA ALERT: Vehicular accident at EDSA Rockwell SB  involving SUV and L300 as of 9:13 AM. 1 lane occupied MMDA on site. #mmda,https://twitter.com/mmda/status/1031358966989615104
8/20/2018,8:42 AM,EDSA GUADIX,14.589432,121.057243,NB,STALLED L300 DUE TO MECHANICAL PROBLEM,1.0,L300,MMDA ALERT: Stalled L300 due to mechanical problem at EDSA Guadix NB as of 8:42 AM. 1 lane occupied. MMDA enforcer on site. #mmda,https://twitter.com/mmda/status/1031359069653585920
8/20/2018,10:27 AM,ORTIGAS CLUB FILIPINO,14.601846,121.046754,EB,VEHICULAR ACCIDENT,1.0,2 CARS,MMDA ALERT: Vehicular accident at Ortigas Club Filipino EB  involving 2 Cars as of 10:27 AM. 1 lane occupied MMDA on site. #mmda,https://twitter.com/mmda/status/1031371124842483712
8/20/2018,11:18 AM,C5 KALAYAAN,14.556079,121.062936,SB,VEHICULAR ON FIRE,1.0,BUS,MMDA ALERT: Vehicular on fire at C5 Kalayaan SB involving bus as of 11:18 AM. 1 lane occupied BFP on site. #mmda,https://twitter.com/mmda/status/1031385843796074496
8/20/2018,12:33 PM,EDSA ORTIGAS ROBINSONS,14.592515,121.058225,NB,VEHICULAR ACCIDENT,1.0,CAR AND BUS,MMDA ALERT: Vehicular accident at EDSA Ortigas Robinsons NB  involving Car and bus as of 12:33 PM. 1 lane occupied MMDA on site. #mmda,https://twitter.com/mmda/status/1031400304917368832
8/20/2018,12:39 PM,EDSA LIGHT MALL,14.574014,121.04841,NB,MULTIPLE COLLISION,2.0,3 CARS,MMDA ALERT: Multiple collision at EDSA Light Mall NB involving 3 car's as of 12:39 PM. 2 lanes occupied MMDA on site. #mmda,https://twitter.com/mmda/status/1031402505031151617
8/20/2018,12:39 PM,EDSA LIGHT MALL,14.574014,121.04841,NB,MULTIPLE COLLISION,2.0,3 CARS,MMDA ALERT: Multiple collision at EDSA Light Mall NB involving 3 car's as of 12:39 PM. 2 lanes occupied MMDA on site. #mmda,https://twitter.com/mmda/status/1031405794124738560
8/20/2018,2:51 PM,EDSA FARMERS,14.619717,121.050978,NB,VEHICULAR ACCIDENT,1.0,BUS AND CAR,MMDA ALERT: Vehicular accident at EDSA Farmers NB involving bus and car as of 2:51pm PM. 1 lane occupied. MMDA enforcer on site. #mmda,https://twitter.com/mmda/status/1031435510793756673
8/20/2018,4:14 PM,C5 LANUZA,14.577625,121.073462,SB,STALLED TRUCK DUE TO MECHANICAL PROBLEM,1.0,TRUCK,MMDA ALERT: Stalled Truck due to mechanical problem at C5 Lanuza SB as of 4:14 PM. 1 lane occupied. MMDA enforcer on site. #mmda,https://twitter.com/mmda/status/1031454965225611264
8/20/2018,5:17 PM,C5 ATENEO KATIPUNAN,14.638481,121.07454,NB,MULTIPLE COLLISION C5ENEO KAT,1.0,"CLOSED VAN, TRUCK, CAR AND MC","MMDA ALERT: Multiple collision at C5 Ateneo Katipunan NB involving closed van, truck, car and MC as of 5:17 PM. 2 l… https://t.co/KV9s1aRW1s",https://twitter.com/mmda/status/1031481471083601920
8/20/2018,6:21 PM,EDSA BONI,14.638481,121.07454,NB,STALLED BUS DUE TO MECHANICAL DEFECT,1.0,BUS,MMDA ALERT: Stalled Bus due to mechanical defect at EDSA Boni NB as pf 6:21 PM. 1 lane occupied. MMDA enforcer on site. #mmda,https://twitter.com/mmda/status/1031487629357764608
8/20/2018,7:19 PM,MARCOS HIGHWAY LRT SANTOLAN,14.622242,121.086405,EB,VEHICULAR ACCIDENT,1.0,PUJ AND AUV,MMDA ALERT: Vehicular accident at Marcos Highway LRT Santolan EB involving PUJ and AUV as of 7:19PM. 1 lane occupie… https://t.co/fnFCyLIlmO,https://twitter.com/mmda/status/1031503746553901056
8/20/2018,7:44 PM,EDSA HERITAGE,14.537348,120.993593,NB,VEHICULAR ACCIDENT,1.0,TAXI AND TRUCK,MMDA ALERT: Vehicular accident at EDSA Heritage NB involving taxi and truck as of 7:44 PM. 1 lane occupied. MMDA enforcer on site. #mmda,https://twitter.com/mmda/status/1031510935356157953
8/20/2018,8:58 PM,C5 ORTIGAS FLYOVER,14.589706,121.079945,NB,STALLED CLOSED VAN DUE TO MECHANICAL DEFECT,1.0,CLOSED VAN,MMDA ALERT: Stalled Closed van due to mechanical defect at C5 Ortigas flyover NB as of 8: 58 PM. 1 lane occupied. M… https://t.co/3A3PfaO62F,https://twitter.com/mmda/status/1031529829554741248
8/20/2018,8:58 PM,C5 ORTIGAS FLYOVER,14.589706,121.079945,NB,STALLED CLOSED VAN DUE TO MECHANICAL DEFECT,1.0,CLOSED VAN,MMDA ALERT: Stalled Closed van due to mechanical defect at C5 Ortigas flyover NB as of 8: 58 PM. 1 lane occupied. M… https://t.co/RMyhtGK32G,https://twitter.com/mmda/status/1031529850941521921
8/20/2018,7:05 AM,EDSA ERMIN GARCIA,14.628035,121.047229,SB,STALLED BUS DUE TO MECHANICAL PROBLEM,1.0,BUS,MMDA ALERT: Stalled bus due to mechanical problem at EDSA Ermin Garcia SB as of 7:05 AM. 1 lane occupied. MMDA enforcer on site. #mmda,https://twitter.com/mmda/status/1031682905804656640
8/21/2018,7:05 AM,EDSA ERMIN GARCIA,14.628035,121.047229,SB,STALLED BUS DUE TO MECHANICAL PROBLEM,1.0,BUS,MMDA ALERT: Stalled bus due to mechanical problem at EDSA Ermin Garcia SB as of 7:05 AM. 1 lane occupied. MMDA enforcer on site. #mmda,https://twitter.com/mmda/status/1031702349415215105
8/21/2018,9:50 AM,EDSA GUADALUPE PET PLANS,14.566348,121.045356,SB,ONGOING DPWH ROAD PATCHING,1.0,,MMDA ALERT: Ongoing DPWH road patching at EDSA Guadalupe Pet Plans SB as of 9:50 AM. 1 lane occupied.  MMDA on site. #mmda,https://twitter.com/mmda/status/1031722547341971458
8/21/2018,10:00 AM,COMMONWEALTH DILIMAN,14.659263,121.061261,EB,VEHICULAR ACCIDENT,1.0,2 MC,MMDA ALERT: Vehicular accident at Commonwealth Diliman EB  involving 2 MC as of 10:00 AM. 1 lane occupied MMDA on site. #mmda,https://twitter.com/mmda/status/1031727757347053568
8/21/2018,10:30 AM,ROXAS BACLARAN,14.528998,120.993456,SB,ONGOING DPWH FOOTBRIDGE PAINTING,1.0,,MMDA ALERT: Ongoing DPWH Footbridge Painting at Roxas Baclaran SB as of 10:30 AM. 1 lane occupied MMDA on site. #mmda,https://twitter.com/mmda/status/1031731356345069568
8/21/2018,10:47 AM,C5 EASTWOOD,14.60728,121.078528,SB,VEHICULAR ACCIDENT,1.0,MC AND SUV,MMDA ALERT: Vehicular accident at C5 Eastwood SB  involving MC and SUV as of 10:47 AM. 1 lane occupied MMDA on site. #mmda,https://twitter.com/mmda/status/1031737089656639489
8/21/2018,12:05 PM,EDSA CABRERA,14.537979,121.004863,SB,ONGOING DPWH ROAD PATCHING,1.0,,MMDA ALERT: Ongoing DPWH road patching at EDSA Cabrera SB as of 12:05 PM. 1 lane occupied.  MMDA on site. #mmda,https://twitter.com/mmda/status/1031756189321682944
8/21/2018,1:28 PM,LACSON F/O,14.609729,120.99272,SB,ONGOING DPWH ASPHALT LAYING,1.0,,MMDA ALERT: Ongoing DPWH Asphalt laying at Lacson f/o SB as of 1:28 PM. 1 lane occupied.  MMDA on site. #mmda,https://twitter.com/mmda/status/1031778102949494785
8/21/2018,3:03 PM,NORTH AVE. AGHAM,14.653739,121.038708,EB.,VEHICULAR ACCIDENT,2.0,VAN AND PUJ,MMDA ALERT: Vehicular accident at North Ave. Agham EB. involving van and PUJ as of 3:03 PM. 2 lanes occupied. MMDA enforcer on site. #mmda,https://twitter.com/mmda/status/1031801277779308544
8/21/2018,6:20 AM,MARCOS HIGHWAY LIGAYA,14.618807,121.092719,WB,VEHICULAR ACCIDENT,1.0,VAN AND SUV,MMDA ALERT: Vehicular accident at Marcos Highway Ligaya WB  involvingVan and SUV as of 6:20 AM. 1 lane occupied MMDA on site. #mmda,https://twitter.com/mmda/status/1032033284534857728
8/21/2018,6:30 AM,QUEZON AVENUE,14.639754,121.030335,WB,VEHICULAR ACCIDENT,1.0,BUS AND CAR,MMDA ALERT: Vehicular accident at Quezon Avenue WB  involving Bus and car as of 6:30 AM. 1 lane occupied MMDA on site. #mmd,https://twitter.com/mmda/status/1032033628551663616
8/21/2018,6:30 AM,QUEZON AVENUE,14.639754,121.030335,WB,VEHICULAR ACCIDENT,1.0,BUS AND CAR,MMDA ALERT: Vehicular accident at Quezon Avenue WB  involving Bus and car as of 6:30 AM. 1 lane occupied MMDA on site. #mmda,https://twitter.com/mmda/status/1032033651066724352
8/21/2018,6:39 AM,EDSA AYALA TUNNEL,14.550028,121.029058,NB,STALLED L300 DUE TO MECHANICAL PROBLEM,1.0,L300,MMDA ALERT: Stalled L300 due to mechanical problem at EDSA Ayala Tunnel NB as of 6:39 AM. 1 lane occupied. MMDA enforcer on site. #mmda,https://twitter.com/mmda/status/1032035752467554304
8/21/2018,6:41 AM,EDSA NEPA Q-MART,14.627928,121.047259,NB,VEHICULAR ACCIDENT,1.0,BUS AND CAR,MMDA ALERT: Vehicular accident at EDSA Nepa Q-Mart NB  involving Bus and car as of  6:41 AM. 1 lane occupied MMDA on site. #mmda,https://twitter.com/mmda/status/1032036229607448577
8/21/2018,6:42 AM,EDSA P. TUAZON,14.616404,121.052548,SB,VEHICULAR ACCIDENT,1.0,2 SUV'S,MMDA ALERT: Vehicular accident at EDSA P. Tuazon SB  involving 2 SUV's as of  6:42 AM. 1 lane occupied MMDA on site. #mmda,https://twitter.com/mmda/status/1032036565961175040
8/21/2018,6:48 AM,C5 GREENMEADOWS,14.601442,121.079351,SB,VEHICULAR ACCIDENT,1.0,CAR AND MC,MMDA ALERT: Vehicular accident at C5 Greenmeadows SB involving car and Mc as of  6:48 AM. 1 lane occupied MMDA on site. #mmda,https://twitter.com/mmda/status/1032040486033219585
8/21/2018,7:16 AM,COMMONWEALTH LUZON,14.66533,121.070469,WB,VEHICULAR ACCIDENT,1.0,SUV AND PUJ,MMDA ALERT: Vehicular accident at Commonwealth Luzon WB involving SUV and PUJ as of  7:16 AM. 1 lane occupied MMDA on site. #mmda,https://twitter.com/mmda/status/1032046835903295488
8/21/2018,7:20 AM,LUZON F/O,14.665241,121.070339,SB,VEHICULAR ACCIDENT,1.0,CAR AND SUV,MMDA ALERT: Vehicular accident at Luzon f/o SB involving car and SUV as of  7:20 AM. 1 lane occupied MMDA on site. #mmda,https://twitter.com/mmda/status/1032047326804598784
8/21/2018,7:21 AM,ELLIPTICAL,14.65424,121.049788,DAR,VEHICULAR ACCIDENT,1.0,CAR AND VAN,MMDA ALERT: Vehicular accident at Elliptical DAR involving car and van as of 7:21 AM. 1 lane occupied MMDA on site. #mmda,https://twitter.com/mmda/status/1032048636073455616
8/21/2018,7:27 AM,EDSA P. TUAZON TUNNEL,14.616404,121.052548,SB,STALLED BUS DUE TO MECHANICAL PROBLEM,1.0,BUS,MMDA ALERT: Stalled bus due to mechanical problem at EDSA P. Tuazon tunnel SB as of 7:27 AM. 1 lane occupied. MMDA enforcer on site. #mmda,https://twitter.com/mmda/status/1032050747511201792
8/22/2018,8:15 AM,EDSA ESTRELLA,14.559818,121.040737,SB,VEHICULAR ACCIDENT,1.0,CAR AND AUV,MMDA ALERT: Vehicular accident at EDSA Estrella SB involving car and AUV as of 8:15 AM. 1 lane occupied MMDA on site. #mmda,https://twitter.com/mmda/status/1032062432057778177
8/22/2018,8:35 AM,EDSA RELIANCE,14.576702,121.050365,SB,VEHICULAR ACCIDENT,1.0,CAR AND MC,MMDA ALERT: Vehicular accident at EDSA Reliance SB involving car and MC as of 8:35 AM. 1 lane occupied MMDA on site. #mmda,https://twitter.com/mmda/status/1032067432230281217
8/22/2018,8:58 AM,QUEZON AVE. AGHAM,14.646323,121.040861,WB,VEHICULAR ACCIDENT,1.0,CAR AND AUV,MMDA ALERT: Vehicular accident at Quezon Ave. Agham WB involving car and AUV as of 8:58 AM. 1 lane occupied MMDA on site. #mmda,https://twitter.com/mmda/status/1032072441852354561
8/22/2018,8:59 AM,ROXAS BLVD. BUENDIA AVE.,14.552294,120.989491,NB,VEHICULAR ACCIDENT,1.0,CAR AND BUS,MMDA ALERT: Vehicular accident at Roxas blvd. Buendia Ave. NB involving car and bus as of 8:59 AM. 1 lane occupied MMDA on site. #mmda,https://twitter.com/mmda/status/1032075954338680832
8/22/2018,9:07 AM,MINDANAO ROAD 20,14.671786,121.032319,NB,ONGOING DPWH ROAD PATCHING,1.0,,MMDA ALERT: Ongoing DPWH Road Patching at Mindanao road 20 NB as of 9:07 AM. 1 lane occupied. MMDA on site. #mmda,https://twitter.com/mmda/status/1032076101613281280
8/22/2018,9:32 AM,B. SERRANO KATIPUNAN TUNNEL,14.61474,121.070685,SB,STALLED VAN DUE TO MECHANICAL PROBLEM,1.0,VAN,MMDA ALERT: Stalled van due to mechanical problem at B. Serrano Katipunan tunnel SB as of 9:32 AM. 1 lane occupied.… https://t.co/qTdfOdN4AQ,https://twitter.com/mmda/status/1032081665772769280
8/22/2018,10:15 AM,EDSA BUENDIA,14.554949,121.034967,SB,VEHICULAR ACCIDENT,1.0,TAXI AND BUS,MMDA ALERT: Vehicular accident at EDSA Buendia SB involving taxi and bus as of 10:15 AM. 1 lane occupied MMDA on site. #mmda,https://twitter.com/mmda/status/1032094428347822081
8/22/2018,10:37 AM,EDSA BUENDIA SPLIT,14.555822,121.035928,SB,VEHICULAR ACCIDENT,1.0,CAR AND SUV,MMDA ALERT: Vehicular accident at EDSA Buendia Split SB involving car and SUV as of 10:37 AM. 1 lane occupied MMDA on site. #mmda,https://twitter.com/mmda/status/1032099200312401925
8/22/2018,10:51 AM,EDSA PET PLANS,14.561892,121.04307,SB,VEHICULAR ACCIDENT,1.0,CAR AND VAN,MMDA ALERT: Vehicular accident at EDSA Pet Plans SB involving car and van as of 10:51 AM. 1 lane occupied MMDA on site. #mmda,https://twitter.com/mmda/status/1032099414154735618
8/22/2018,10:58 AM,C5 LIBIS,14.603015,121.079256,NB,VEHICULAR ACCIDENT,1.0,PICK UP ELF TRUCK,MMDA ALERT: Vehicular accident at C5 Libis NB involving pick up elf truck as of 10:58 AM. 1 lane occupied MMDA on site. #mmda,https://twitter.com/mmda/status/1032103520558673921
8/22/2018,1:40 PM,EDSA STARMALL,14.582431,121.054467,SB,VEHICULAR ACCIDENT,1.0,2 BUSES,MMDA ALERT: Vehicular accident at EDSA Starmall SB involving 2 buses as of 1:40 PM. 1 lane occupied MMDA on site. #mmda,https://twitter.com/mmda/status/1032142239579815936
8/22/2018,2:01 PM,ELLIPTICAL,14.65424,121.049788,,STALLED JEEP DUE TO MECHANICAL DEFECT,1.0,JEEP,MMDA ALERT: Stalled jeep due to mechanical defect at Elliptical Road frontng NHA as of 2:01 PM. 1 lane occupied. MM… https://t.co/jKNJ0qL96Y,https://twitter.com/mmda/status/1032148785902759936
8/22/2018,2:05 PM,EDSA QUEZON AVENUE FLYOVER,14.582431,121.054467,NB,VEHICULAR ACCIDENT,1.0,MOTORCYCLE,MMDA ALERT: Vehicular accident at EDSA Quezon avenue flyover NB involving motorcycle  as of 2:05 PM. 1 lane occupie… https://t.co/slXbNZ5r7J,https://twitter.com/mmda/status/1032150340919939073
8/22/2018,2:13 PM,ELLIPTICAL,14.65424,121.049788,,VEHICULAR ACCIDENT,1.0,VAN AND CAR,MMDA ALERT: Vehicular accident at Elliptical Road fronting NHA involving van and car as of 2:13 PM. 1 lane occupied… https://t.co/lORwYaMwWT,https://twitter.com/mmda/status/1032151572782837760
8/22/2018,2:21 PM,ROXAS BLVD. P.OCAMPO,14.559551,120.987075,SB,MULTIPLE COLLISION,1.0,"2 VAN, AUV AND TAXI","MMDA ALERT: Multiple collision at Roxas Blvd. P.Ocampo SB involving 2 van, AUV and taxi as of 2:21 PM. 1 lane occup… https://t.co/9kJERH2h1f",https://twitter.com/mmda/status/1032154510578212864
8/22/2018,2:43 PM,AURORA BLVD. KATIPUNAN,14.631692,121.074217,EB,STALLED TRUCK DUE TO MECHANICAL DEFECT,1.0,TRUCK,MMDA ALERT: Stalled truck due to mechanical defect at Aurora Blvd. Katipunan EB as of 2:43 PM. 1 lane occupied. MMDA enforcer on site. #mmda,https://twitter.com/mmda/status/1032158101107961857
8/22/2018,2:44 PM,KATIPUNAN ATENEO,14.638481,121.07454,SB,STALLED TRUCK DUE TO MECHANICAL DEFECT KATIPUNAN,1.0,TRUCK,MMDA ALERT: Stalled truck due to mechanical defect at Katipunan Ateneo SB as of 2:44 PM. 1 lane occupied. MMDA enforcer on site. #mmda,https://twitter.com/mmda/status/1032159302935404544
8/22/2018,2:50 PM,AURORA BLVD. KATIPUNAN,14.631692,121.074217,WB,VEHICULAR ACCIDENT,1.0,VAN AND MOTORCYCLE,MMDA ALERT: Vehicular accident at Aurora Blvd. Katipunan WB involving van and Motorcycle as of 2:50 PM. 1 lane occu… https://t.co/CuWOcRCENk,https://twitter.com/mmda/status/1032159652669079552
8/22/2018,2:50 PM,MARCOS HIGHWAY TOWN AND COUNTRY,14.621658,121.106498,EB,VEHICULAR ACCIDENT,1.0,ELF TRUCK AND MOTORCYCLE,MMDA ALERT: Vehicular accident at Marcos Highway Town and Country EB involving Elf truck and motorcycle as of 3:22… https://t.co/02B3BcU8OX,https://twitter.com/mmda/status/1032173330575413248
8/22/2018,3:31 PM,EDSA MONTE DE PIEDAD,14.62385,121.049123,,STALLED BUS DUE TO MECHANICAL DEFECT,1.0,BUS,MMDA ALERT: Stalled bus due to mechanical defect at  EDSA Monte De Piedad as of 3:31 PM. 1 lane occupied. MMDA enforcer on site. #MMDA,https://twitter.com/mmda/status/1032179817188286464
8/22/2018,3:47 PM,COMMONWEALTH ATHERTON,14.708553,121.062717,EB,VEHICULAR ACCIDENT COMMONWEALTH,1.0,MOTORCYCLE AND PEDESTRIAN,MMDA ALERT: Vehicular accident at Commonwealth Atherton EB involving motorcycle and pedestrian as of 3:47 PM. 1 lan… https://t.co/5T7eF6NIzd,https://twitter.com/mmda/status/1032179863287816192
8/22/2018,4:18 PM,EDSA BUENDIA,14.554949,121.034967,NB,VEHICULAR ACCIDENT,1.0,CAR AND VAN,MMDA ALERT: Vehicular accident at EDSA Buendia NB involving car and van as of 4:18 PM. 1 lane occupied. MMDA enforcer on site. #mmda,https://twitter.com/mmda/status/1032188783045705728
8/22/2018,4:19 PM,KATIPUNAN CP GARCIA,14.648291,121.0744,NB,VEHICULAR ACCIDENT KAT,1.0,CAR AND TAXI,MMDA ALERT: Vehicular accident at Katipunan CP Garcia NB involving car and taxi as of 4:19 PM. 1 lane occupied. MMDA enforcer on site. #mmda,https://twitter.com/mmda/status/1032189901112926208
8/22/2018,4:40 PM,C5 CALLE INDUSTRIA,14.605472,121.079122,NB,VEHICULAR ACCIDENT,1.0,CAR AND TAXI,MMDA ALERT: Vehicular accident at C5 Calle Industria NB involving car and taxi as of 4:40 PM. 1 lane occupied. MMDA enforcer on site. #mmda,https://twitter.com/mmda/status/1032192555335606277
8/22/2018,4:44 PM,C3 A.BONIFACIO,14.643822,120.993705,WB,STALLED TRUCK DUE TO MECHANICAL PROBLEM,1.0,TRUCK,MMDA ALERT: Stalled truck due to mechanical problem at C3 A.Bonifacio WB as of 4:44 PM. 1 lane occupied. MMDA enforcer on site. #mmda,https://twitter.com/mmda/status/1032192979656560640
8/22/2018,5:24 PM,EDSA STARMALL SERVICE ROAD,14.582431,121.054467,SB,VEHICULAR ACCIDENT,2.0,2 BUS,MMDA ALERT: Vehicular accident at EDSA Starmall Service Road SB involving 2 bus as of 5:24 PM. 2 lane occupied. MMDA enforcer on site. #mmda,https://twitter.com/mmda/status/1032199257392992256
8/22/2018,5:58 PM,EDSA WHITEPLAINS,14.599652,121.05969,NB,STALLED BUS DUE TO MECHANICAL PROBLEM,1.0,BUS,MMDA ALERT: Stalled bus due to mechanical problem at EDSA Whiteplains NB as of 5:58 PM. 1 lane occupied. MMDA enforcer on site. #mmda,https://twitter.com/mmda/status/1032206556043984897
8/22/2018,6:02 PM,EDSA GUDALUPE,14.566348,121.045356,NB,STALLED BUS DUE TO MECHANICAL PROBLEM,1.0,BUS,MMDA ALERT: Stalled bus due to mechanical problem at EDSA Gudalupe NB as of 6:02 PM. 1 lane occupied. MMDA enforcer on site. #mmda,https://twitter.com/mmda/status/1032208344159678465
8/22/2018,6:24 PM,EAST SERVICE ROAD PNR RAILROAD,14.499519,121.039452,SB,STALLED TRUCK DUE TO MECHANICAL PROBLEM,1.0,TRUCK,MMDA ALERT: Stalled Truck due to mechanical problem at East service road PNR railroad SB as of 6:24 PM. 1 lane occu… https://t.co/JeaqOebiCD,https://twitter.com/mmda/status/1032214612433727488
8/22/2018,8:07 PM,QUEZON AVENUE ARANETA TUNNEL,14.628351,121.013365,EB,STALLED CAR DUE TO FLAT TIRE,1.0,CAR,MMDA ALERT: Stalled car due to flat tire at Quezon Avenue Araneta Tunnel EB as of 8:07 PM. 1 lane occupied. MMDA enforcer on site. #mmda,https://twitter.com/mmda/status/1032241462384025602
8/22/2018,12:07 AM,COMMONWEALTH LUZON,14.66533,121.070469,,VEHICULAR ACCIDENT,1.0,MC AND CAR,MMDA ALERT: Vehicular accident at Commonwealth Luzon infront of Loyola Chapel involving MC and car as of 12:07 AM 1… https://t.co/ZG2HmoNPGA,https://twitter.com/mmda/status/1032301266766942208
8/22/2018,5:18 AM,EDSA GUADALUPE,14.566348,121.045356,NB,STALLED BUS DUE TO MECHANICAL PROBLEM,1.0,BUS,MMDA ALERT: Stalled bus due to mechanical problem at EDSA Guadalupe NB as of 5:18 AM. 1 lane occupied. MMDA on site. #mmda,https://twitter.com/mmda/status/1032377836789673984
8/22/2018,5:13 AM,ORTIGAS GREENHILLS,14.566348,121.048658,,STALLED DUMP TRUCK DUE TO MECHANICAL PROBLEM,1.0,DUMP TRUCK,MMDA ALERT: Stalled dump truck due to mechanical problem at Ortigas Greenhills as of 5:13 AM. 1 lane occupied. MMDA on site. #mmda,https://twitter.com/mmda/status/1032378391104696320
8/23/2018,7:54 AM,EDSA MRT SANTOLAN,14.566348,121.055583,SB,VEHICULAR ACCIDENT,1.0,SUV AND MC,MMDA ALERT: Vehicular accident at EDSA MRT Santolan  SB involving SUV and MC as of 7:54 AM. 1 lane occupied MMDA on site. #mmda,https://twitter.com/mmda/status/1032421427893260288
8/23/2018,8:08 AM,"QUEZON AVE, ARANETA TUNNEL",14.628351,121.013365,EB,VEHICULAR ACCIDENT,1.0,VIOS AND MC,"MMDA ALERT: Vehicular accident at Quezon Ave, Araneta tunnel EB involving vios and MC as of 8:08 AM. 1 lane occupied MMDA on site. #mmda",https://twitter.com/mmda/status/1032421663122415616
8/23/2018,8:32 AM,EDSA TRINOMA,14.652928,121.031852,NB,STALLED BUS DUE TO MECHANICAL PROBLEM,1.0,BUS,MMDA ALERT: Stalled bus due to mechanical problem at EDSA Trinoma NB as of 8:32 AM. 1 lane occupied. MMDA enforcer on site. #mmda,https://twitter.com/mmda/status/1032426682076946432
8/23/2018,8:32 AM,EDSA TRINOMA,14.652928,121.031852,NB,STALLED BUS DUE TO MECHANICAL PROBLEM,1.0,BUS,MMDA ALERT: Stalled bus due to mechanical problem at EDSA Trinoma NB as of 8:32 AM. 1 lane occupied. MMDA enforcer on site. #mmda,https://twitter.com/mmda/status/1032428111516725248
8/23/2018,8:45 AM,C5 BAGONG ILOG,14.564141,121.069619,SB,VEHICULAR ACCIDENT,1.0,INNOVA AND MC,MMDA ALERT: Vehicular accident at C5 Bagong Ilog SB  involving innova and MC as of 8:45 AM. 1 lane occupied MMDA on site. #mmda,https://twitter.com/mmda/status/1032430742184194048
8/23/2018,8:53 AM,EDSA MAGALLANES F/O,14.540271,121.016837,NB,VEHICULAR ACCIDENT,2.0,"INNOVA, CAR AND MC","MMDA ALERT: Vehicular accident at EDSA Magallanes F/O NB involving innova, car and MC as of 8:53 AM. 2 lanes occupied MMDA on site. #mmda",https://twitter.com/mmda/status/1032434125863444480
8/23/2018,9:22 AM,EDSA P. TUAZON TUNNEL,14.616404,121.052548,SB,STALLED CAR DUE TO MECHANICAL PROBLEM,1.0,CAR,MMDA ALERT: Stalled car due to mechanical problem at EDSA P. Tuazon tunnel SB as of 9:22 AM. 1 lane occupied. MMDA enforcer on site. #mmda,https://twitter.com/mmda/status/1032440562505244672
8/23/2018,9:29 AM,LACSON FAJARDO,14.607495,120.994955,NB,VEHICULAR ACCIDENT,1.0,"INNOVA, CAR AND PUJ","MMDA ALERT: Vehicular accident at Lacson Fajardo NB involving innova, car and PUJ as of 9:29 AM. 1 lane occupied MMDA on site. #mmda",https://twitter.com/mmda/status/1032441161967841280
8/23/2018,9:39 AM,EDSA BUENDIA,14.554949,121.034967,SB,ONGOING ANTI SMOKE BELCHING OPERATION,1.0,,MMDA ALERT: Ongoing Anti Smoke belching operation at EDSA Buendia SB as of 9:39 AM. 1 lane occupied.  MMDA on site. #mmda,https://twitter.com/mmda/status/1032444599342518272
8/23/2018,10:20 AM,EDSA ERMIN GARCIA,14.628035,121.047229,SB,VEHICULAR ACCIDENT,1.0,VAN AND CAR,MMDA ALERT: Vehicular accident at EDSA Ermin Garcia SB involving van and car as of 10:20 AM. 1 lane occupied MMDA on site. #mmda,https://twitter.com/mmda/status/1032457474597502977
8/23/2018,10:46 AM,MARCOS HIGHWAY DELA PAZ,14.628035,121.095678,WB,VEHICULAR ACCIDENT,1.0,MC AND CAR,MMDA ALERT: Vehicular accident at Marcos highway Dela Paz WB involving MC and car as of 10:46 AM. 1 lane occupied MMDA on site. #mmda,https://twitter.com/mmda/status/1032462554050830336
8/23/2018,10:50 AM,KATIPUNAN MIRIAM,14.644291,121.074626,SB,VEHICULAR ACCIDENT KAT,1.0,VAN AND CAR,MMDA ALERT: Vehicular accident at Katipunan Miriam SB involving van and car as of 10:50 AM. 1 lane occupied MMDA on site. #mmda,https://twitter.com/mmda/status/1032462579807924224
8/23/2018,11:04 AM,EDSA AYALA TUNNEL,14.550028,121.029058,NB,MULTIPLE COLLISION,1.0,3 CAR'S,MMDA ALERT: Multiple collision at EDSA Ayala tunnel NB involving 3 car's as of 11:04 AM. 1 lane occupied MMDA on site. #mmda,https://twitter.com/mmda/status/1032468821573955585
8/23/2018,12:21 PM,MARCOS HIGHWAY BURGER KING,14.621218,121.10425,WB,MULTIPLE COLLISION,2.0,"VAN,SUV AND CAR","MMDA ALERT:Multiple collision at Marcos highway Burger king WB  involving van,SUV and car as of 12:21 PM. 2 lanes o… https://t.co/xZaLLtxR8W",https://twitter.com/mmda/status/1032484554622218240
8/23/2018,12:32 PM,ELLIPTICAL VISAYAS,14.621218,121.047569,WB,VEHICULAR ACCIDENT,1.0,2 CARS,MMDA ALERT: Vehicular accident at Elliptical Visayas WB involving 2 cars as of 12:32 PM. 1 lane occupied MMDA on site. #mmda,https://twitter.com/mmda/status/1032489744175783936
8/23/2018,1:10 PM,C5 EASTWOOD,14.60728,121.078528,NB,ONGOING DPWH ROAD PATCHING,1.0,,MMDA ALERT: Ongoing DPWH road patching at C5 Eastwood NB as of 1:10 PM. 1 lane occupied MMDA on site. #mmda,https://twitter.com/mmda/status/1032499734928224257
8/23/2018,2:13 PM,EDSA ESTRELLA,14.559818,121.040737,SB,STALLED VAN DUE TO FLAT TIRE,1.0,VAN,MMDA ALERT: Stalled van due to flat tire at EDSA Estrella SB as of 2:13 PM. 1 lane occupied. MMDA enforcer on site. #mmda,https://twitter.com/mmda/status/1032513706649776129
8/23/2018,3:16 PM,EDSA SHAW TUNNEL,14.581153,121.053565,NB,STALLED TAXI DUE TO MECHANICAL PROBLEM,1.0,TAXI,MMDA ALERT: Stalled taxi due to mechanical problem at EDSA Shaw tunnel NB as of 3:16 PM. 1 lane occupied. MMDA enforcer on site. #mmda,https://twitter.com/mmda/status/1032534362481283073
8/23/2018,4:57 PM,EDSA MUÑOZ,14.657668,121.017212,NB,VEHICULAR ACCIDENT,1.0,TRUCK AND CAR,MMDA ALERT: Vehicular accident at EDSA Muñoz NB involving truck and car as of 4:57 PM. 1 lane occupied. MMDA enforcer on site. #mmda,https://twitter.com/mmda/status/1032556229631954945
8/23/2018,5:14 PM,ORTIGAS CLUB FILIPINO,14.601846,121.046754,WB,VEHICULAR ACCIDENT,1.0,SUV AND CAR,MMDA ALERT: Vehicular accident at Ortigas Club Filipino WB involving SUV and car as of 5:14 PM. 1 lane occupied. MM… https://t.co/OlagCKrjpJ,https://twitter.com/mmda/status/1032559315394019328
8/23/2018,5:49 PM,C5 MARKET MARKET,14.549718,121.05755,NB,VEHICULAR ACCIDENT,2.0,CAR AND CLOSED VAN,MMDA ALERT: Vehicular accident at C5 Market Market NB involving car and closed van as of 5:49 PM. 2 lanes occupied. MMDA on site. #mmda,https://twitter.com/mmda/status/1032567803570601984
